{"batch_digest":"2108b26e5cc40aa178b3cd77668664279bf818bc437c4f68ce60bffa5de27f6a","candidate_count":2,"candidates":[{"article_id":"c155617d7b3fa0d531201add1a89baf007626233c2dd16b0895120f143aef47a","candidate_digest":"c797b262fc622c062e160fa3fb682de3e38fc596549e7d35f5deb8252d4225a2","canonical_url":"https://example.net/bytes-two","categories":null,"categories_basis":null,"display_pillar":"B","origins":[{"discovered_at":"2026-09-05T12:00:00Z","input_artifact":{"artifact_id":"capture-two.json","sha256":"8888888888888888888888888888888888888888888888888888888888888888"},"original_snippet":"byte-for-byte identical captured evidence","original_summary":null,"original_title":null,"pillar":"B","row":"/0","snippet_basis":"upstream_artifact","source":"web","summary_basis":null,"title_basis":null,"url":"https://example.net/bytes-two"}],"schema_version":"url-first-article-candidate.v1","summary":null,"summary_basis":null,"title":null,"title_basis":null,"url":"https://example.net/bytes-two"},{"article_id":"4a1dc31d4ed7f920141611bf922e0cfe23b3f111558ce571b11e599aa5fa7630","candidate_digest":"9ef06fc2db644d49e453c5b126a2c60f4d877eb4d37e93c6f706e8a53c1fb229","canonical_url":"https://example.org/bytes-one","categories":null,"categories_basis":null,"display_pillar":"B","origins":[{"discovered_at":"2026-09-05T12:00:00Z","input_artifact":{"artifact_id":"capture-one.json","sha256":"7777777777777777777777777777777777777777777777777777777777777777"},"original_snippet":"byte-for-byte identical captured evidence","original_summary":null,"original_title":null,"pillar":"B","row":"/0","snippet_basis":"upstream_artifact","source":"web","summary_basis":null,"title_basis":null,"url":"https://example.org/bytes-one"}],"schema_version":"url-first-article-candidate.v1","summary":null,"summary_basis":null,"title":null,"title_basis":null,"url":"https://example.org/bytes-one"}],"schema_version":"url-first-article-candidate-batch.v1"}
