{"batch_digest":"cb4daf2cbe002ef52f529107bb7ca8c167f7d51bfbbf7742727a0ce7375821e7","candidate_count":2,"candidates":[{"article_id":"75822839028b75a7ec40117f107c2c369126be289fa8439d84ec1a8909b4dda9","candidate_digest":"e946d6147a148b610f3802777c0bbf2c2f993f8d227537d1fdef655eb2e0a87a","canonical_url":"https://example.net/story-two","categories":null,"categories_basis":null,"display_pillar":"B","origins":[{"discovered_at":"2026-09-05T12:00:00Z","input_artifact":{"artifact_id":"input.json","sha256":"8888888888888888888888888888888888888888888888888888888888888888"},"original_snippet":null,"original_summary":null,"original_title":"Shared climate title","pillar":"B","row":"/0","snippet_basis":null,"source":"web","summary_basis":null,"title_basis":"search_result","url":"https://example.net/story-two"}],"schema_version":"url-first-article-candidate.v1","summary":null,"summary_basis":null,"title":"Shared climate title","title_basis":"search_result","url":"https://example.net/story-two"},{"article_id":"ae0e07ae13b4c6aa6d737f5ce1aea2eea1abf24883feb7573ceba773bf3ee6d3","candidate_digest":"d4e2f9f51a0d81bb828d6028594c91f0c97b1f948fb0b66df1385af7039e2b5b","canonical_url":"https://example.org/story-one","categories":null,"categories_basis":null,"display_pillar":"B","origins":[{"discovered_at":"2026-09-05T12:00:00Z","input_artifact":{"artifact_id":"input.json","sha256":"9999999999999999999999999999999999999999999999999999999999999999"},"original_snippet":null,"original_summary":null,"original_title":"Shared climate title","pillar":"B","row":"/0","snippet_basis":null,"source":"web","summary_basis":null,"title_basis":"search_result","url":"https://example.org/story-one"}],"schema_version":"url-first-article-candidate.v1","summary":null,"summary_basis":null,"title":"Shared climate title","title_basis":"search_result","url":"https://example.org/story-one"}],"schema_version":"url-first-article-candidate-batch.v1"}
